[
  {"schema_version":"phase7a-label-v1","example_id":"synthetic-a-row-1","screenshot_sha256":"0000000000000000000000000000000000000000000000000000000000000001","capture_group_id":"synthetic-session-a","image":{"width":720,"height":1280,"crop":{"left":0,"top":0,"right":720,"bottom":1280}},"row":{"index":1,"bbox":{"left":20,"top":160,"right":700,"bottom":300}},"fields":{"phone":{"visible_text":"+91 98765 43210","normalized":"+919876543210","status":"verified","bbox":null},"message":{"visible_text":"Need a room near office","status":"verified","truncated":false,"bbox":null},"timestamp":{"visible_text":"2:30 pm","kind":"clock_time","status":"verified","bbox":null}},"review":{"approved_for_training":true,"reviewer":"synthetic-reviewer","status":"verified"},"dataset_version":"synthetic-v1","synthetic":true},
  {"schema_version":"phase7a-label-v1","example_id":"synthetic-a-row-2","screenshot_sha256":"0000000000000000000000000000000000000000000000000000000000000002","capture_group_id":"synthetic-session-a","image":{"width":720,"height":1280,"crop":{"left":0,"top":100,"right":720,"bottom":1280}},"row":{"index":2,"bbox":{"left":20,"top":300,"right":700,"bottom":440}},"fields":{"phone":{"visible_text":"+91 98B65 43210","normalized":null,"status":"ambiguous","bbox":null},"message":{"visible_text":"Is it available...","status":"truncated","truncated":true,"bbox":null},"timestamp":{"visible_text":"Yesterday","kind":"relative_word","status":"verified","bbox":null}},"review":{"approved_for_training":false,"reviewer":"synthetic-reviewer","status":"ambiguous"},"dataset_version":"synthetic-v1","synthetic":true},
  {"schema_version":"phase7a-label-v1","example_id":"synthetic-b-row-1","screenshot_sha256":"0000000000000000000000000000000000000000000000000000000000000003","capture_group_id":"synthetic-session-b","image":{"width":1080,"height":1920,"crop":{"left":0,"top":0,"right":1080,"bottom":1920}},"row":{"index":1,"bbox":{"left":30,"top":220,"right":1050,"bottom":390}},"fields":{"phone":{"visible_text":null,"normalized":null,"status":"not_visible","bbox":null},"message":{"visible_text":null,"status":"unreadable","truncated":false,"bbox":null},"timestamp":{"visible_text":"Monday","kind":"weekday","status":"verified","bbox":null}},"review":{"approved_for_training":true,"reviewer":"synthetic-reviewer","status":"verified"},"dataset_version":"synthetic-v1","synthetic":true}
]
